{"version":"canon_geo_home_cell_assignment.v1","request_version":"canon_geo_home_cell_rows.v1","coordinate_crs":"EPSG:4326","coordinate_decimal_places":7,"h3_resolution":9,"stability_radius_fixed":1,"features":[{"source":{"source_instance_id":"census_geocoder_current","release":{"release_id":"benchmark=Public_AR_Current;vintage=Current_Current","release_digest":"blake3:470ad41037434cc536256220021d2c47c04c9a072287b40f174ed2969f0eb36d"},"native_scope":{"kind":"native_entity","entity_level":"address","identity_participation":"evidence_only"},"inventory_ref":{"inventory_id":"geo.retry_recovery.acquisition.census_geocoder_current","semantic_hash":"blake3:192cf3aadb861ef7cd87ae2a24a7950c3a279bd0f1c7cb8ea0351ecb72e448a8","planning_hash":"blake3:192cf3aadb861ef7cd87ae2a24a7950c3a279bd0f1c7cb8ea0351ecb72e448a8"}},"feature_id":"geo.retry_recovery.e1.gross_class.0028.candidate.001","source_record_id":"geo.retry_recovery.e1.gross_class.0028.source_record.001","geometry_sha256":"3dbb4bc9542a02e6601d79173be3411628d15b8a2e138b245e6ab4741ece0dbe","representative_point_method":"provider_geocode_point_wgs84_e7","representative_point_fixed":{"longitude":-737330309,"latitude":407700776},"home_cell":"892a1005413ffff","stability_cells":["892a1005413ffff"],"minimum_stability_halo_k":0,"claimed_home_cell":"892a1005413ffff","parity":"match"}],"tile_work_features":[{"source":{"source_instance_id":"census_geocoder_current","release":{"release_id":"benchmark=Public_AR_Current;vintage=Current_Current","release_digest":"blake3:470ad41037434cc536256220021d2c47c04c9a072287b40f174ed2969f0eb36d"},"native_scope":{"kind":"native_entity","entity_level":"address","identity_participation":"evidence_only"},"inventory_ref":{"inventory_id":"geo.retry_recovery.acquisition.census_geocoder_current","semantic_hash":"blake3:192cf3aadb861ef7cd87ae2a24a7950c3a279bd0f1c7cb8ea0351ecb72e448a8","planning_hash":"blake3:192cf3aadb861ef7cd87ae2a24a7950c3a279bd0f1c7cb8ea0351ecb72e448a8"}},"feature_id":"geo.retry_recovery.e1.gross_class.0028.candidate.001","home_cell":"892a1005413ffff"}],"summary":{"total":1,"boundary_sensitive":0,"max_minimum_stability_halo_k":0,"claimed":1,"matches":1,"mismatches":0,"unclaimed":0}}