{"version":"canon_geo_home_cell_assignment.v1","request_version":"canon_geo_home_cell_rows.v1","coordinate_crs":"EPSG:4326","coordinate_decimal_places":7,"h3_resolution":9,"stability_radius_fixed":1,"features":[{"source":{"source_instance_id":"census_geocoder_current","release":{"release_id":"benchmark=Public_AR_Current;vintage=Current_Current","release_digest":"blake3:470ad41037434cc536256220021d2c47c04c9a072287b40f174ed2969f0eb36d"},"native_scope":{"kind":"native_entity","entity_level":"address","identity_participation":"evidence_only"},"inventory_ref":{"inventory_id":"geo.retry_recovery.acquisition.census_geocoder_current","semantic_hash":"blake3:22ef4b5bbb4e5b68db65b997efccd475435d630c9bd904d46db0428b4d8317fc","planning_hash":"blake3:22ef4b5bbb4e5b68db65b997efccd475435d630c9bd904d46db0428b4d8317fc"}},"feature_id":"geo.retry_recovery.e1.gross_class.0014.candidate.001","source_record_id":"geo.retry_recovery.e1.gross_class.0014.source_record.001","geometry_sha256":"6903fa38f370ff7f4fc09a38048e6c42f72c950be80fbbb0ff92eef10b34cf84","representative_point_method":"provider_geocode_point_wgs84_e7","representative_point_fixed":{"longitude":-740024190,"latitude":407198549},"home_cell":"892a1072c0fffff","stability_cells":["892a1072c0fffff"],"minimum_stability_halo_k":0,"claimed_home_cell":"892a1072c0fffff","parity":"match"}],"tile_work_features":[{"source":{"source_instance_id":"census_geocoder_current","release":{"release_id":"benchmark=Public_AR_Current;vintage=Current_Current","release_digest":"blake3:470ad41037434cc536256220021d2c47c04c9a072287b40f174ed2969f0eb36d"},"native_scope":{"kind":"native_entity","entity_level":"address","identity_participation":"evidence_only"},"inventory_ref":{"inventory_id":"geo.retry_recovery.acquisition.census_geocoder_current","semantic_hash":"blake3:22ef4b5bbb4e5b68db65b997efccd475435d630c9bd904d46db0428b4d8317fc","planning_hash":"blake3:22ef4b5bbb4e5b68db65b997efccd475435d630c9bd904d46db0428b4d8317fc"}},"feature_id":"geo.retry_recovery.e1.gross_class.0014.candidate.001","home_cell":"892a1072c0fffff"}],"summary":{"total":1,"boundary_sensitive":0,"max_minimum_stability_halo_k":0,"claimed":1,"matches":1,"mismatches":0,"unclaimed":0}}