{"version":"canon_geo_home_cell_assignment.v1","request_version":"canon_geo_home_cell_rows.v1","coordinate_crs":"EPSG:4326","coordinate_decimal_places":7,"h3_resolution":9,"stability_radius_fixed":1,"features":[{"source":{"source_instance_id":"census_geocoder_current","release":{"release_id":"benchmark=Public_AR_Current;vintage=Current_Current","release_digest":"blake3:470ad41037434cc536256220021d2c47c04c9a072287b40f174ed2969f0eb36d"},"native_scope":{"kind":"native_entity","entity_level":"address","identity_participation":"evidence_only"},"inventory_ref":{"inventory_id":"geo.retry_recovery.acquisition.census_geocoder_current","semantic_hash":"blake3:e51ce5b0f1f779eb044f31eed6aaf9bd94bf12cbacbe9827bae8945ea6e05d0c","planning_hash":"blake3:e51ce5b0f1f779eb044f31eed6aaf9bd94bf12cbacbe9827bae8945ea6e05d0c"}},"feature_id":"geo.retry_recovery.e1.gross_class.0027.candidate.001","source_record_id":"geo.retry_recovery.e1.gross_class.0027.source_record.001","geometry_sha256":"b4a1dcafadcec24f46934b4bf9b5255e51e6adf224e376fb18ebb9c7e87bc243","representative_point_method":"provider_geocode_point_wgs84_e7","representative_point_fixed":{"longitude":-739267053,"latitude":407653230},"home_cell":"892a100f34bffff","stability_cells":["892a100f34bffff"],"minimum_stability_halo_k":0,"claimed_home_cell":"892a100f34bffff","parity":"match"}],"tile_work_features":[{"source":{"source_instance_id":"census_geocoder_current","release":{"release_id":"benchmark=Public_AR_Current;vintage=Current_Current","release_digest":"blake3:470ad41037434cc536256220021d2c47c04c9a072287b40f174ed2969f0eb36d"},"native_scope":{"kind":"native_entity","entity_level":"address","identity_participation":"evidence_only"},"inventory_ref":{"inventory_id":"geo.retry_recovery.acquisition.census_geocoder_current","semantic_hash":"blake3:e51ce5b0f1f779eb044f31eed6aaf9bd94bf12cbacbe9827bae8945ea6e05d0c","planning_hash":"blake3:e51ce5b0f1f779eb044f31eed6aaf9bd94bf12cbacbe9827bae8945ea6e05d0c"}},"feature_id":"geo.retry_recovery.e1.gross_class.0027.candidate.001","home_cell":"892a100f34bffff"}],"summary":{"total":1,"boundary_sensitive":0,"max_minimum_stability_halo_k":0,"claimed":1,"matches":1,"mismatches":0,"unclaimed":0}}