{"version":"canon_geo_home_cell_assignment.v1","request_version":"canon_geo_home_cell_rows.v1","coordinate_crs":"EPSG:4326","coordinate_decimal_places":7,"h3_resolution":9,"stability_radius_fixed":1,"features":[{"source":{"source_instance_id":"census_geocoder_current","release":{"release_id":"benchmark=Public_AR_Current;vintage=Current_Current","release_digest":"blake3:470ad41037434cc536256220021d2c47c04c9a072287b40f174ed2969f0eb36d"},"native_scope":{"kind":"native_entity","entity_level":"address","identity_participation":"evidence_only"},"inventory_ref":{"inventory_id":"geo.retry_recovery.acquisition.census_geocoder_current","semantic_hash":"blake3:e75c3f1face4f2d7f1b74696ddc2a60b91bf99a46855021c6662b8bfc6f74ae8","planning_hash":"blake3:e75c3f1face4f2d7f1b74696ddc2a60b91bf99a46855021c6662b8bfc6f74ae8"}},"feature_id":"geo.retry_recovery.e1.gross_class.0030.candidate.001","source_record_id":"geo.retry_recovery.e1.gross_class.0030.source_record.001","geometry_sha256":"549bc0fff920f065fcac417cfb81fa7b928602f84b6024812ed1a1633a38be82","representative_point_method":"provider_geocode_point_wgs84_e7","representative_point_fixed":{"longitude":-739475736,"latitude":408251558},"home_cell":"892a100aa2fffff","stability_cells":["892a100aa2fffff"],"minimum_stability_halo_k":0,"claimed_home_cell":"892a1008babffff","parity":"mismatch"}],"tile_work_features":[{"source":{"source_instance_id":"census_geocoder_current","release":{"release_id":"benchmark=Public_AR_Current;vintage=Current_Current","release_digest":"blake3:470ad41037434cc536256220021d2c47c04c9a072287b40f174ed2969f0eb36d"},"native_scope":{"kind":"native_entity","entity_level":"address","identity_participation":"evidence_only"},"inventory_ref":{"inventory_id":"geo.retry_recovery.acquisition.census_geocoder_current","semantic_hash":"blake3:e75c3f1face4f2d7f1b74696ddc2a60b91bf99a46855021c6662b8bfc6f74ae8","planning_hash":"blake3:e75c3f1face4f2d7f1b74696ddc2a60b91bf99a46855021c6662b8bfc6f74ae8"}},"feature_id":"geo.retry_recovery.e1.gross_class.0030.candidate.001","home_cell":"892a100aa2fffff"}],"summary":{"total":1,"boundary_sensitive":0,"max_minimum_stability_halo_k":0,"claimed":1,"matches":0,"mismatches":1,"unclaimed":0}}