{"version":"canon_geo_home_cell_assignment.v1","request_version":"canon_geo_home_cell_rows.v1","coordinate_crs":"EPSG:4326","coordinate_decimal_places":7,"h3_resolution":9,"stability_radius_fixed":1,"features":[{"source":{"source_instance_id":"census_geocoder_current","release":{"release_id":"benchmark=Public_AR_Current;vintage=Current_Current","release_digest":"blake3:470ad41037434cc536256220021d2c47c04c9a072287b40f174ed2969f0eb36d"},"native_scope":{"kind":"native_entity","entity_level":"address","identity_participation":"evidence_only"},"inventory_ref":{"inventory_id":"geo.retry_recovery.acquisition.census_geocoder_current","semantic_hash":"blake3:f3ff356e71787a1aea7f7684f9ba758754bc76b39b05cea807e999ae4324aee8","planning_hash":"blake3:f3ff356e71787a1aea7f7684f9ba758754bc76b39b05cea807e999ae4324aee8"}},"feature_id":"geo.retry_recovery.e1.gross_class.0024.candidate.001","source_record_id":"geo.retry_recovery.e1.gross_class.0024.source_record.001","geometry_sha256":"8bcfbca85209e3a4f433b31dc82afa25cc9e1165e6273f08fb0bdbfaf4ecf56d","representative_point_method":"provider_geocode_point_wgs84_e7","representative_point_fixed":{"longitude":-738179221,"latitude":407595436},"home_cell":"892a100e033ffff","stability_cells":["892a100e033ffff"],"minimum_stability_halo_k":0,"claimed_home_cell":"892a100e033ffff","parity":"match"}],"tile_work_features":[{"source":{"source_instance_id":"census_geocoder_current","release":{"release_id":"benchmark=Public_AR_Current;vintage=Current_Current","release_digest":"blake3:470ad41037434cc536256220021d2c47c04c9a072287b40f174ed2969f0eb36d"},"native_scope":{"kind":"native_entity","entity_level":"address","identity_participation":"evidence_only"},"inventory_ref":{"inventory_id":"geo.retry_recovery.acquisition.census_geocoder_current","semantic_hash":"blake3:f3ff356e71787a1aea7f7684f9ba758754bc76b39b05cea807e999ae4324aee8","planning_hash":"blake3:f3ff356e71787a1aea7f7684f9ba758754bc76b39b05cea807e999ae4324aee8"}},"feature_id":"geo.retry_recovery.e1.gross_class.0024.candidate.001","home_cell":"892a100e033ffff"}],"summary":{"total":1,"boundary_sensitive":0,"max_minimum_stability_halo_k":0,"claimed":1,"matches":1,"mismatches":0,"unclaimed":0}}