{"version":"canon_geo_home_cell_assignment.v1","request_version":"canon_geo_home_cell_rows.v1","coordinate_crs":"EPSG:4326","coordinate_decimal_places":7,"h3_resolution":9,"stability_radius_fixed":1,"features":[{"source":{"source_instance_id":"census_geocoder_current","release":{"release_id":"benchmark=Public_AR_Current;vintage=Current_Current","release_digest":"blake3:470ad41037434cc536256220021d2c47c04c9a072287b40f174ed2969f0eb36d"},"native_scope":{"kind":"native_entity","entity_level":"address","identity_participation":"evidence_only"},"inventory_ref":{"inventory_id":"geo.retry_recovery.acquisition.census_geocoder_current","semantic_hash":"blake3:6b3706e03051750bf8233cdf2323f08a3a2bf13dfae688b2e4e2eaed403b28f7","planning_hash":"blake3:6b3706e03051750bf8233cdf2323f08a3a2bf13dfae688b2e4e2eaed403b28f7"}},"feature_id":"geo.retry_recovery.e1.gross_class.0011.candidate.001","source_record_id":"geo.retry_recovery.e1.gross_class.0011.source_record.001","geometry_sha256":"10362bc8088ac434a5a804ccfdb3f2f35578f593312762d2d468f77ca6273306","representative_point_method":"provider_geocode_point_wgs84_e7","representative_point_fixed":{"longitude":-739139120,"latitude":407002774},"home_cell":"892a100dca7ffff","stability_cells":["892a100dca7ffff"],"minimum_stability_halo_k":0,"claimed_home_cell":"892a100dca7ffff","parity":"match"}],"tile_work_features":[{"source":{"source_instance_id":"census_geocoder_current","release":{"release_id":"benchmark=Public_AR_Current;vintage=Current_Current","release_digest":"blake3:470ad41037434cc536256220021d2c47c04c9a072287b40f174ed2969f0eb36d"},"native_scope":{"kind":"native_entity","entity_level":"address","identity_participation":"evidence_only"},"inventory_ref":{"inventory_id":"geo.retry_recovery.acquisition.census_geocoder_current","semantic_hash":"blake3:6b3706e03051750bf8233cdf2323f08a3a2bf13dfae688b2e4e2eaed403b28f7","planning_hash":"blake3:6b3706e03051750bf8233cdf2323f08a3a2bf13dfae688b2e4e2eaed403b28f7"}},"feature_id":"geo.retry_recovery.e1.gross_class.0011.candidate.001","home_cell":"892a100dca7ffff"}],"summary":{"total":1,"boundary_sensitive":0,"max_minimum_stability_halo_k":0,"claimed":1,"matches":1,"mismatches":0,"unclaimed":0}}